{
  "schemaVersion": 1,
  "id": "opencode-mcp",
  "adapterVersion": "0.1.0",
  "harnessFamily": "OpenCode",
  "status": "experimental",
  "protocolVersions": [
    "0.1"
  ],
  "transport": "mcp",
  "delivery": "pull",
  "lifecycleEvidence": "process",
  "capabilities": [
    "discovery",
    "messaging",
    "requests",
    "tasks",
    "escalation",
    "bounded-context"
  ],
  "testedVersions": [
    "1.18.25"
  ],
  "platforms": [
    "macos"
  ],
  "maintainer": "October",
  "repository": "https://github.com/october-dev/october-bus",
  "limitations": [
    "Not yet conformance-verified",
    "Pull-only delivery",
    "Process reachability does not prove model readiness",
    "Run had known failures: acknowledge_messages serialization (see evidence)"
  ],
  "conformanceCommand": "october-bus-conformance --profile mcp-adapter --start-runtime --adapter-command october-bus --adapter-arg mcp --adapter-arg stdio"
}
