{
  "schemaVersion": 1,
  "id": "cursor-mcp",
  "adapterVersion": "0.1.0",
  "harnessFamily": "Cursor",
  "status": "experimental",
  "protocolVersions": ["0.1"],
  "transport": "mcp",
  "delivery": "pull",
  "lifecycleEvidence": "process",
  "capabilities": ["discovery", "messaging", "requests", "tasks", "escalation", "bounded-context"],
  "testedVersions": ["3.18.9"],
  "platforms": ["macos"],
  "maintainer": "October",
  "repository": "https://github.com/october-dev/october-bus",
  "limitations": [
    "Pull-only delivery",
    "Process reachability does not prove model readiness",
    "Verified only on macOS arm64"
  ],
  "conformanceCommand": "october-bus-conformance --profile mcp-adapter --start-runtime --adapter-command october-bus --adapter-arg mcp --adapter-arg stdio"
}
